{
  "name": "default",
  "description": "Authenticates with various 3rd party services!",
  "message": "Welcome to the HTTPSanction!",
  "methodViewRouteParams": [
    {
      "name": "memoization",
      "module": "app.routes",
      "className": "Memoization",
      "params": [
        "string:path"
      ],
      "methods": [
        "GET",
        "DELETE"
      ]
    }
  ],
  "authRouteParams": [
    {
      "name": "callback",
      "module": "app.routes.auth",
      "className": "Callback"
    },
    {
      "name": "auth",
      "module": "app.routes.auth",
      "className": "Auth",
      "methods": ["GET", "PATCH"]
    }
  ],
  "blueprintRouteParams": [
    {
      "name": "ipsum",
      "module": "app.routes",
      "funcName": "ipsum"
    }
  ],
  "providerNames": [
    "airtable",
    "cloze",
    "github",
    "gusto",
    "keycdn",
    "mailgun",
    "postmark",
    "quickbooks",
    "timely",
    "xero"
  ]
}
